{
  "$schema": "../../../types/mode.schema.json",
  "id": "studio",
  "name": {
    "ko": "스튜디오",
    "en": "Studio"
  },
  "icon": "🏢",
  "version": "1.0.0",
  "apiVersion": "1.0",
  "entry": "mode.js",
  "styles": [
    "mode.css"
  ],
  "author": {
    "name": "built-in"
  },
  "description": {
    "ko": "귀여운 도트 동물 직원들의 개발 스튜디오: 세션마다 한 층, 코드 조각·타자 소리, 입력 필요 시 사장실 방문, 도감·상점, 작은 창 미니 보기",
    "en": "A cute pixel-animal dev studio: one floor per session, flying code bits and typing sound, elevator visits to the boss when input is needed, dex and shop, small lobby-view window"
  },
  "license": "MIT",
  "locale": "ko",
  "uses": [
    "subagents",
    "todos",
    "limits",
    "tokens"
  ],
  "chimeWave": "triangle",
  "widget": true
}
