{
  "$schema": "../../../types/mode.schema.json",
  "id": "flow",
  "name": {
    "ko": "흐름",
    "en": "Flow"
  },
  "icon": "🌊",
  "version": "1.0.0",
  "apiVersion": "1.0",
  "entry": "mode.js",
  "styles": [
    "mode.css"
  ],
  "author": {
    "name": "built-in"
  },
  "description": {
    "ko": "한 요청을 '생각의 강'으로: 단계 색, 도구 점, 발화, 탐험 지도, 돌아보기",
    "en": "One request as a river of thought: phases, tool dots, messages, exploration map, mind map"
  },
  "license": "MIT",
  "locale": "ko",
  "needs": [
    "trace"
  ],
  "uses": [
    "subagents",
    "trace",
    "thinking"
  ]
}
