{
  "$schema": "../../../types/mode.schema.json",
  "id": "hamster",
  "name": {
    "ko": "햄찌",
    "en": "Hamster"
  },
  "icon": "🐹",
  "version": "1.0.0",
  "apiVersion": "1.0",
  "entry": "mode.js",
  "styles": [
    "mode.css"
  ],
  "author": {
    "name": "built-in"
  },
  "description": {
    "ko": "세션마다 햄찌 한 마리: 도구별 모션·말풍선, 아기 햄찌, 연주회, 칭호, 리플레이, 오늘의 햄찌 카드",
    "en": "A hamster per session: tool animations, speech bubbles, baby hamsters, concert, titles, replay, daily card"
  },
  "license": "MIT",
  "locale": "ko",
  "needs": [
    "memo"
  ],
  "uses": [
    "subagents",
    "todos",
    "limits",
    "tokens"
  ],
  "chimeWave": "square"
}
